{
  "name": "ecommerce-fixture",
  "description": "v1 ecommerce project — Phase 8 Step 3 마이그레이션 검증용",
  "domain": "ecommerce",
  "version": "1.0.0",
  "kitVersion": "1.45.1",
  "kitSource": "https://github.com/wejsa/ai-crew-kit.git",
  "techStack": {
    "backend": "nodejs-typescript",
    "frontend": "nextjs",
    "database": "postgresql",
    "cache": "redis",
    "messageQueue": "none",
    "infrastructure": "docker-compose"
  },
  "agents": {
    "enabled": ["pm", "backend", "frontend", "code-reviewer", "qa"],
    "disabled": ["planner", "docs", "db-designer", "devops"]
  },
  "conventions": {
    "taskPrefix": "SHOP",
    "branchStrategy": "git-flow",
    "commitFormat": "conventional",
    "prLineLimit": 500,
    "testCoverage": 80,
    "language": "ko"
  },
  "metadata": {
    "version": 1,
    "updatedAt": "2026-04-14T00:00:00Z"
  },
  "createdAt": "2026-02-15T00:00:00Z"
}
