{
  "name": "general-fixture",
  "description": "v1 범용 project — 마이그레이션 회귀 검증용 (도메인 무관)",
  "domain": "general",
  "version": "1.0.0",
  "kitVersion": "1.45.1",
  "kitSource": "https://github.com/wejsa/ai-crew-kit.git",
  "techStack": {
    "backend": "spring-boot-kotlin",
    "frontend": "none",
    "database": "mysql",
    "cache": "redis",
    "messageQueue": "none",
    "infrastructure": "none"
  },
  "agents": {
    "enabled": ["pm", "backend", "code-reviewer", "qa"],
    "disabled": ["planner", "frontend", "docs", "db-designer", "devops"]
  },
  "conventions": {
    "taskPrefix": "TASK",
    "branchStrategy": "git-flow",
    "commitFormat": "conventional",
    "prLineLimit": 500,
    "testCoverage": 80,
    "language": "ko"
  },
  "metadata": {
    "version": 1,
    "updatedAt": "2026-04-14T00:00:00Z"
  },
  "createdAt": "2026-02-03T00:00:00Z"
}
